{
  "thesis_id": "s03e05-men-against-fire-full-fidelity-gap",
  "episode_id": "s03e05-men-against-fire",
  "title": "Full-fidelity gap for: Military AR HUD alters perception of enemies",
  "thesis_statement": "Full episode-faithful execution of the complete socio-technical outcome, not merely components: Implanted or helmet systems modify soldiers' visual/auditory perception so targets appear non-human, enabling killing and controlling PTSD narrative.",
  "ai_role": "Real-time CV classification, generative overlay, biometric feedback control.",
  "non_ai_enablers": [
    "military doctrine",
    "medical implants",
    "war crimes law",
    "full population-scale integration"
  ],
  "enabling_tech": [
    "military_ar",
    "bci",
    "target_classification",
    "perceptual_manipulation"
  ],
  "ai_capability_tags": [
    "cv",
    "ar",
    "classification"
  ],
  "spoiler_level": "high",
  "special_handling": "none",
  "harm_severity": 5
}
