{
  "thesis_id": "s02e01-be-right-back-griefbot-persona-from-data",
  "episode_id": "s02e01-be-right-back",
  "title": "Chat/voice AI persona of deceased from digital footprint",
  "thesis_statement": "Services train chat and voice agents on a dead person's posts and messages so bereaved can converse with a simulation.",
  "ai_role": "LLM personalization, voice cloning, style mimicry from social data.",
  "non_ai_enablers": [
    "social media archives",
    "consent/estate law",
    "grief counseling norms"
  ],
  "enabling_tech": [
    "llm_persona",
    "voice_clone",
    "digital_afterlife"
  ],
  "ai_capability_tags": [
    "llm",
    "tts",
    "personalization"
  ],
  "spoiler_level": "low",
  "special_handling": "none",
  "harm_severity": 2
}
