{
  "thesis_id": "s05e02-smithereens-partial-real-world-analogue",
  "episode_id": "s05e02-smithereens",
  "title": "Partial real-world analogue of: Attention platform holds psychological power over users and state",
  "thesis_statement": "Partial systems exist that approximate aspects of this thesis without full episode fidelity: A social platform's addiction design and data power create crises where individual trauma and corporate control collide.",
  "ai_role": "Engagement ranking, notification optimization, crisis PR analytics.",
  "non_ai_enablers": [
    "smartphone ubiquity",
    "corporate power",
    "law enforcement process"
  ],
  "enabling_tech": [
    "social_media",
    "recommendation_systems",
    "push_notifications"
  ],
  "ai_capability_tags": [
    "recommendation",
    "engagement_optimization"
  ],
  "spoiler_level": "low",
  "special_handling": "none",
  "harm_severity": 2
}
