{
  "thesis_id": "s04e04-hang-the-dj-full-fidelity-gap",
  "episode_id": "s04e04-hang-the-dj",
  "title": "Full-fidelity gap for: Dating system runs thousands of relationship simulations",
  "thesis_statement": "Full episode-faithful execution of the complete socio-technical outcome, not merely components: A matchmaking service evaluates couples via massive simulated relationships and outputs match confidence.",
  "ai_role": "Preference models, simulation of social dynamics, multi-agent relationship modeling.",
  "non_ai_enablers": [
    "dating app markets",
    "user consent to experiments",
    "full population-scale integration"
  ],
  "enabling_tech": [
    "matchmaking_ml",
    "multi_agent_sim",
    "mobile_dating"
  ],
  "ai_capability_tags": [
    "recommendation",
    "multi_agent",
    "personalization"
  ],
  "spoiler_level": "high",
  "special_handling": "none",
  "harm_severity": 2
}
