{
  "thesis_id": "s06e03-beyond-the-sea-full-fidelity-gap",
  "episode_id": "s06e03-beyond-the-sea",
  "title": "Full-fidelity gap for: Humans operate replica bodies remotely across distance",
  "thesis_statement": "Full episode-faithful execution of the complete socio-technical outcome, not merely components: Astronauts' consciousness links to Earth replica bodies for dual lives; violence against replicas has catastrophic effects.",
  "ai_role": "Teleoperation, latency compensation, body control policies.",
  "non_ai_enablers": [
    "replica hardware",
    "space isolation",
    "cult violence",
    "full population-scale integration"
  ],
  "enabling_tech": [
    "telepresence",
    "android_body",
    "high_bandwidth_link"
  ],
  "ai_capability_tags": [
    "robotics_control",
    "teleop"
  ],
  "spoiler_level": "high",
  "special_handling": "none",
  "harm_severity": 4
}
