{
  "thesis_id": "s03e03-shut-up-and-dance-partial-real-world-analogue",
  "episode_id": "s03e03-shut-up-and-dance",
  "title": "Partial real-world analogue of: Blackmail network uses remote device compromise",
  "thesis_statement": "Partial systems exist that approximate aspects of this thesis without full episode fidelity: Attackers capture compromising footage via malware and coerce victims into escalating crimes under threat of exposure.",
  "ai_role": "Target selection, automated phishing, deepfake enhancement of blackmail material (optional).",
  "non_ai_enablers": [
    "malware economy",
    "social engineering",
    "criminal markets"
  ],
  "enabling_tech": [
    "malware",
    "webcam_hijack",
    "anonymity_networks",
    "deepfake_optional"
  ],
  "ai_capability_tags": [
    "phishing_automation",
    "gen_image"
  ],
  "spoiler_level": "low",
  "special_handling": "none",
  "harm_severity": 4
}
