{
  "thesis_id": "s04e02-arkangel-partial-real-world-analogue",
  "episode_id": "s04e02-arkangel",
  "title": "Partial real-world analogue of: Parental implant filters child's perception and tracks location",
  "thesis_statement": "Partial systems exist that approximate aspects of this thesis without full episode fidelity: A parent-controlled implant blocks distressing stimuli, shows live feed, and enables content filters that damage autonomy.",
  "ai_role": "Content classification, distress detection, live video analytics.",
  "non_ai_enablers": [
    "pediatric implant ethics",
    "parental rights law",
    "child development"
  ],
  "enabling_tech": [
    "bci",
    "parental_controls",
    "content_filter",
    "location_tracking"
  ],
  "ai_capability_tags": [
    "cv",
    "content_moderation",
    "biometrics"
  ],
  "spoiler_level": "low",
  "special_handling": "none",
  "harm_severity": 3
}
